{
  "balance": {
    "balanced": true,
    "domain_task_counts": {
      "isolation": 2,
      "orchestration": 2,
      "storage": 2,
      "streaming": 2
    },
    "overlap_policy": "all-reviewers-review-all-non-holdout-tasks",
    "packet_labels": [
      "A",
      "B"
    ],
    "tasks_per_reviewer": 8
  },
  "frozen_inputs": {
    "benchmark_ref": "data/benchmark/mth-0174-cross-system.json",
    "benchmark_version": "mth-0174-v1",
    "negative_knowledge_ref": "data/negative-knowledge/contract-boundaries.json",
    "source_digest_semantics": "Digests identify packet inputs; candidate and evidence digests identify payloads and excerpts separately.",
    "source_digests": {
      "benchmark": "sha256:0079440b630a7319b73d0934fd01610b2773854047ab62787a8b3560bfb0b2e1",
      "card:airflow": "sha256:1d5d1e50c2f5c023b3057477316480aa9a2c23e1592e8f0b4f10a1eef5de6e87",
      "card:carryctx": "sha256:bdee6db652f2e13f88077c89294f42e535e0ecd46ff123a3277cffe7dd284158",
      "card:duckdb": "sha256:8a23865635e4faeb4578bf50445fc89864a51711e2d82957ab16c23c04c2fdd6",
      "card:firecracker": "sha256:427013dd1da343f1fd6a1e66df39aaff7f9b421ad8fdeb6a9f2f673df49eaf5d",
      "card:git": "sha256:3bcaa2f349bde0e04880458d6a7e1af58dca647c6e755a87eafb740124cc9e40",
      "card:kafka": "sha256:94d42d238d89a9612613470c8f8b9d15b24816e8349e5e097bf309b23a1e5e14",
      "card:kubernetes": "sha256:8c5b331dd3b52f6b828f7d7720b7988de733dd2edf89eaf1b136fcad9a6dde05",
      "card:postgresql": "sha256:2eb9a8b36744c1e67150b408bbacb16ba667d9d7ffa85d971e48bf1cf9b1a32f",
      "card:sqlite": "sha256:0525331c12e917358ab27afa437d86407ba86ca32fddf38638ea8c79dcaaf761",
      "card:temporal": "sha256:a8de115ba218d6059b0731f7a3874a23df5d6523146a5ca2cb0abc81b6dbe055",
      "frozen_study": "sha256:df743e79fc96a8b0b3f7b6f8fc48880241ad903c18d8b46ae911af1b23ca553a",
      "negative_knowledge": "sha256:a24eba82119bdb9f77037184194fe4050f675a0ae9c0bbccd1531445547e77ff"
    },
    "study_ref": "data/research-review/mth-0175-study.json",
    "study_version": "mth-0175-reviewer-study-v1"
  },
  "holdout_isolation": {
    "allowed_reference": "opaque boundary reference only",
    "candidate_content_in_packets": false,
    "evidence_content_in_packets": false,
    "negative_knowledge_content_in_packets": false,
    "partition": "holdout",
    "reason": "Holdout prompts and evidence are withheld to prevent leakage into review packets.",
    "task_ids": [
      "task-03-storage-mechanism",
      "task-06-stream-history",
      "task-09-reconciliation",
      "task-12-boundary-isolation"
    ]
  },
  "instructions": [
    "Review only the assigned candidate and local evidence payload.",
    "Do not infer or request holdout content; holdout tasks are withheld.",
    "Record unknown when supplied material does not support a judgment.",
    "Review independently; reviewer identity and packet labels remain opaque.",
    "These observations do not promote a candidate or canonical card."
  ],
  "non_claims": [
    "No human labels, human evidence, LLM output, empirical result, or promotion is included.",
    "Candidate and evidence payloads are research fixtures, not canonical cards or proofs."
  ],
  "packets": [
    {
      "assignments": [
        {
          "assignment_id": "assignment-4f3b17df19521ba99739a361",
          "candidate": {
            "candidate_digest": "sha256:73129dff908acfe62341853fc949baa782be4e2e454a0b106698bd728b3103aa",
            "candidate_id": "candidate-task-08-reconciliation",
            "claim_type": "inference",
            "evidence_ids": [
              "kubernetes:kubernetes-architecture-doc",
              "kubernetes:kubernetes-controller-doc",
              "airflow:airflow-source-commit",
              "airflow:airflow-architecture-doc",
              "carryctx:carryctx-cli-fixed-commit",
              "carryctx:carryctx-readme-fixed"
            ],
            "notes": "Authored review candidate; not a label, proof, model output, or promoted card.",
            "proven": false,
            "scope": {
              "deployment": "offline review fixture",
              "systems": [
                "kubernetes",
                "airflow",
                "carryctx"
              ],
              "time": "frozen reviewed-card snapshot",
              "workload": "authored cross-system architecture exploration"
            },
            "source_ids": [
              "system:kubernetes",
              "system:airflow",
              "system:carryctx"
            ],
            "statement": "The reviewed systems schedule or reconcile work through documented control or workflow mechanisms, without a universal convergence claim.",
            "system_ids": [
              "kubernetes",
              "airflow",
              "carryctx"
            ],
            "task_id": "task-08-reconciliation"
          },
          "domain_id": "orchestration",
          "evidence": [
            {
              "card_id": "kubernetes",
              "claim_type": "fact",
              "evidence_id": "kubernetes:kubernetes-architecture-doc",
              "excerpt": {
                "evidence_kind": "official-doc",
                "evidence_notes": "Official documentation for control-plane components, nodes, API resources, scheduling, and cluster state.",
                "evidence_title": "Kubernetes cluster architecture",
                "summary": "A distributed control system that exposes declarative resources through an API, persists cluster state, and uses controllers and schedulers to drive observed state toward desired state across nodes."
              },
              "excerpt_digest": "sha256:5dd126f962bb5f785285ac0152e0a6f098adbe18ff60ab2576f813653fd49623",
              "source_id": "system:kubernetes",
              "source_ref": "data/systems/kubernetes.json#evidence/kubernetes-architecture-doc"
            },
            {
              "card_id": "kubernetes",
              "claim_type": "fact",
              "evidence_id": "kubernetes:kubernetes-controller-doc",
              "excerpt": {
                "evidence_kind": "official-doc",
                "evidence_notes": "Official documentation describing controller loops and reconciliation.",
                "evidence_title": "Kubernetes controllers",
                "summary": "A distributed control system that exposes declarative resources through an API, persists cluster state, and uses controllers and schedulers to drive observed state toward desired state across nodes."
              },
              "excerpt_digest": "sha256:8cf1d9fd27fcb028b4a7a55fd7e59e7d436ebcf20fbb0826ca0bea9d0034cf2e",
              "source_id": "system:kubernetes",
              "source_ref": "data/systems/kubernetes.json#evidence/kubernetes-controller-doc"
            },
            {
              "card_id": "airflow",
              "claim_type": "fact",
              "evidence_id": "airflow:airflow-source-commit",
              "excerpt": {
                "evidence_kind": "source-code",
                "evidence_notes": "Fixed official repository revision used as the provenance boundary for this card.",
                "evidence_title": "Apache Airflow source at c01a68cb1e30",
                "summary": "A workflow platform that represents work as DAGs, stores task and workflow state in a metadata database, and uses a scheduler with pluggable executors to dispatch task instances."
              },
              "excerpt_digest": "sha256:26db22b0172aa614822c1fb65e5784f0b75fa132993009738ffcc0920885a35b",
              "source_id": "system:airflow",
              "source_ref": "data/systems/airflow.json#evidence/airflow-source-commit"
            },
            {
              "card_id": "airflow",
              "claim_type": "fact",
              "evidence_id": "airflow:airflow-architecture-doc",
              "excerpt": {
                "evidence_kind": "official-doc",
                "evidence_notes": "Official documentation for DAGs, scheduler, DAG processor, API server, metadata database, workers, and separated deployment.",
                "evidence_title": "Apache Airflow Architecture Overview",
                "summary": "A workflow platform that represents work as DAGs, stores task and workflow state in a metadata database, and uses a scheduler with pluggable executors to dispatch task instances."
              },
              "excerpt_digest": "sha256:24e575986f604c9ae61005e7a8105d185a031bbca7a67d772118ad3fa6bea775",
              "source_id": "system:airflow",
              "source_ref": "data/systems/airflow.json#evidence/airflow-architecture-doc"
            },
            {
              "card_id": "carryctx",
              "claim_type": "fact",
              "evidence_id": "carryctx:carryctx-cli-fixed-commit",
              "excerpt": {
                "evidence_kind": "source-code",
                "evidence_notes": "Fixed upstream CarryCtx CLI revision used for this card.",
                "evidence_title": "CarryCtx CLI source at fixed commit 4ba349da5e9f",
                "summary": "A local-first project lifecycle control layer that persists agent and human collaboration state in SQLite, integrates Git-aware workspaces and checkpoints, and exchanges validated state through mergeable local snapshots."
              },
              "excerpt_digest": "sha256:ced6e2cee7147462e9eff53388dfae217e44adc81b97b65e34673f85e66b3131",
              "source_id": "system:carryctx",
              "source_ref": "data/systems/carryctx.json#evidence/carryctx-cli-fixed-commit"
            },
            {
              "card_id": "carryctx",
              "claim_type": "fact",
              "evidence_id": "carryctx:carryctx-readme-fixed",
              "excerpt": {
                "evidence_kind": "official-doc",
                "evidence_notes": "Official project overview and boundaries for the pinned CLI revision.",
                "evidence_title": "CarryCtx README at fixed CLI commit",